{
  "$schema": "../theme.schema.json",
  "format": 1,
  "id": "one-dark",
  "name": "One Dark",
  "family": "One",
  "mode": "dark",
  "background": {
    "page": "#282c34",
    "surface": "#21252b",
    "raised": "#31363f",
    "input": "#1b1d23",
    "control": "#353b45",
    "selected": "#3a3f4b",
    "code": "#21252b",
    "accent": "#4d78cc",
    "danger": "#e06c75",
    "success": "#98c379",
    "warning": "#e5c07b",
    "info": "#56b6c2",
    "highlight": "#324365",
    "divider": "#181a1f",
    "overlay": "rgba(8, 9, 10, 0.6)",
    "accent-soft": "#2e384c",
    "danger-soft": "#45363e",
    "success-soft": "#3a443f",
    "warning-soft": "#46443f",
    "info-soft": "#2f424b"
  },
  "text": {
    "text": "#abb2bf",
    "strong": "#d7dae0",
    "muted": "#828997",
    "faint": "#5c6370",
    "link": "#61afef",
    "on-accent": "#ffffff",
    "accent": "#759ef2",
    "danger": "#e06c75",
    "success": "#98c379",
    "warning": "#e5c07b",
    "info": "#56b6c2"
  },
  "border": {
    "subtle": "#181a1f",
    "strong": "#5c6370",
    "accent": "#568af2",
    "danger": "#e06c75",
    "success": "#98c379",
    "warning": "#e5c07b",
    "info": "#56b6c2"
  },
  "textOnFill": {
    "accent": "#ffffff",
    "danger": "#282c34",
    "success": "#282c34",
    "warning": "#282c34",
    "info": "#282c34"
  },
  "interface": {
    "visitedLink": "#c678dd",
    "selection": "#3e4451",
    "selectionText": "#d7dae0",
    "scrollbarThumb": "#4b5362",
    "scrollbarTrack": "#282c34"
  }
}
